memo,sim1,sim2,sim3,sim4,ext1,ext2,ext3,ext4
"Coursera, Inc. Verify Coursera, Inc. Verify 015AUUWJJZONNZW Deeplearning.ai",X,"Coursera, Inc. Verify Coursera, Inc. Verify Deeplearning.ai",X,X,X," Coursera, Inc. Bill.com",X,X
CPC*CAFEPRESS.COM 877-8091659 CA,pass,CPC*CAFEPRESS,X,X,X," Coursera, Inc. Verify",X,X
Crate and Barrel,pass,Crate and Barrel,X,X,X,X,CPC*CAFEPRESS,X
CSU FRESNO PARKING FRESNO CA 11/06,CSU FRESNO PARKING FRESNO11/06,CSU FRESNO PARKING FRESNO CA 11/06,CSU FRESNO PARKING FRESNO CA,X,X,X,Crate and Barrel,X
CTS LANGUAGELINK 08552959177 CTS LANGUAGELINK 08552959177 WA Ref55310209S8A Crd6153 Dt11/10,CTS LANGUAGELINK 08552959177 CTS LANGUAGELINK 08552959177 WA 55310209S8A 6153 Dt11/10,CTS S S8A  10,CTS LANGUAGELINK 08552959177 CTS LANGUAGELINK 08552959177 WA S8A,X,X, FRESNO,X,X
DAISO LA15 SAWTE LOS ANGELES CA DAISO LA15 SAWTE LOS ANGELES CA Debit Card,DAISO LA15 SAWTE LOS ANGELESDAISO LA15 SAWTE LOS ANGELES,DAISO SAWTE LOS ANGELES CA DAISO SAWTE LOS ANGELES CA Debit Card,X,X,X,X,CTS S S8A,X
"Deposit CBC Br#: 00584 TID: 3 1 107 BROADWAY,NY,NY",X,Depos,X,X,X, SAWTE LOS,X,X
DESIGNER NEWS VICTORIA DESIGNER NEWS VICTORIA BC Ref8230009AB00 Crd6153 Dt11/27,DESIGNER NEWS VICTORIA DESIGNER NEWS VICTORIA BC 8230009AB00 6153 Dt11/27,DESIGNER NEWS VICTORIA DESIGNER NEWS,DESIGNER NEWS VICTORIA DESIGNER NEWS VICTORIA BC AB00,X,X,X,Depos,X
DISCOVER YOUR DREAM BA,X,DISCOVER YOUR DREAM BA,X,X,X, DESIGNER NEWS VICTORIA,X,X
DOBBS FERRY RESTAURANT DOBBS FERRY RESTAURANT SAN FRANCISCO CA Ref5526352A28A Crd9952 Dt11/17,DOBBS FERRY RESTAURANT DOBBS FERRY RESTAURANTCA 5526352A28A 9952 Dt11/17,DOBBS FERRY RESTAURANT DOBBS FERRY RESTAURANT SAN FRANCIS,DOBBS FERRY RESTAURANT DOBBS FERRY RESTAURANT SAN FRANCISCO CA A28A,X,X,X,X,X
DODEE PAIDANG THAI DODEE PAIDANG THAI B MELBOURNE VI Ref5543793A8AR Crd3846 Dt11/24,DODEE PAIDANG THAI DODEE PAIDANG THAI B MELBOURNE VI 5543793A8AR 3846 Dt11/24,X,DODEE PAIDANG THAI DODEE PAIDANG THAI B MELBOURNE VI A8AR,X,X, DOBBS FERRY,X,X
DOMINION PARENTING NORFOLK VA 0033IN00002 WWW.PARENTHOOD.COM,X,X,X,X,X, DODEE PAIDANG THAI,X,X
DRCHRONO 16507725024 CA DRCHRONO 16507725024 CA Ref5542950ABJJ Crd6153 Dt11/27,DRCHRONO 16507725024DRCHRONO 165077250245542950ABJJ 6153 Dt11/27,X,DRCHRONO 16507725024 CA DRCHRONO 16507725024 CA ABJJ,X,X,X,X,X
DUC LOI SUPERMARKET SAN FRANCIS 10156320171 4155511772,DUC LOI SUPERMARKET10156320171 4155511772,DUC LOI SUPERMARKET SAN FRANCIS,X,X,X,X,DRCHRONO,X
EAT24 *THE CREAMERY EAT24 *THE CREAMERY 8778504024 CA Ref5542950ADJH Crd0653 Dt11/28,EAT24 *THE CREAMERY EAT24 *THE CREAMERY 87785040245542950ADJH 0653 Dt11/28,X,EAT24 *THE CREAMERY EAT24 *THE CREAMERY 8778504024 CA ADJH,X,X,X,X,X
EB AI FRONTIERS EB AI FRONTIERS CONFE 8014137200 CA Ref55429509KLR Crd0653 Dt11/02,EB AI FRONTIERS EB AI FRONTIERS CONFE 801413720055429509KLR 0653 Dt11/02,EB AI FRONTIERS EB AI FRONTIERS,EB AI FRONTIERS EB AI FRONTIERS CONFE 8014137200 CA KLR,X,X, EAT24 *THE CREAMERY,X,X
EDS LOBSTER BAR 6500NEW YORK NY 10156320171 2123433236,EDS LOBSTER BAR 6500NEW YORK10156320171 2123433236,EDS LOBS,X,X,X, EB AI FRONTIERS,X,X
EE TOP UP EE TOP UP VESTA 08081686076 IE Ref1542595AB00 Crd9449 Dt11/25,EE TOP UP EE TOP UP VESTA 08081686076 IE 1542595AB00 9449 Dt11/25,EE TOP UP EE TOP UP VES,EE TOP UP EE TOP UP VESTA 08081686076 IE AB00,X,X,X,EDS LOBS,X
ENNEAGRAM RHETI,pass,ENNEAGRAM RHETI,X,X,X, EE TOP UP,X,X
ENTERPRISE RENT-A-CASAN FRANCIS D788356 4155225900,X,ENTERPRISE RENT-A-CASAN FRANCIS,X,X,X,X,ENNEAGRAM RHETI,X
ENVATO            613-837-6628 U POS Debit,ENVATO 613-837-6628 U POS ,ENVATO            613-837-6628 U POS Debit,X,X,X,X,ENTERPRISE RENT-A-CASAN FRANCIS,X
EURONET PAY & EURONET PAY & TRANSACT MILANO IT Ref55256109R2Y Crd9449 Dt11/08,EURONET PAY & EURONET PAY & TRANSACT MILANO IT 55256109R2Y 9449 Dt11/08,EURONET PAY & EURONET PAY & TRANS,EURONET PAY & EURONET PAY & TRANSACT MILANO IT R2Y,X,X,X,X,X
"EXO, INC. 8443967768 EXO, INC. 8443967768 NY Ref55429509TJH Crd9960 Dt11/09","EXO, INC. 8443967768 EXO, INC. 844396776855429509TJH 9960 Dt11/09",X,"EXO, INC. 8443967768 EXO, INC. 8443967768 NY TJH",X,X, EURONET PAY &,X,X
"EXO, INC. 8443967768 EXO, INC. 8443967768 NY Ref5542950ADJH Crd9960 Dt11/29","EXO, INC. 8443967768 EXO, INC. 84439677685542950ADJH 9960 Dt11/29",X,"EXO, INC. 8443967768 EXO, INC. 8443967768 NY ADJH",X,X," EXO, INC.",X,X
FARM AT THE CARNEROSNAPA CA 0000059004 0000059004 94559,FARM AT THE CARNEROSNAPA0000059004 0000059004 94559,FARM AT THE CARNEROS,X,X,X," EXO, INC.",X,X
FARM FRESH TO FARM FRESH TO YOU 800-796-6009 CA Ref55432869N5S Crd0653 Dt11/06,FARM FRESH TO FARM FRESH TO YOU 800-796-600955432869N5S 0653 Dt11/06,FARM FRESH TO FARM FRES S  06,FARM FRESH TO FARM FRESH TO YOU 800-796-6009 CA N5S,X,X,X,X,X
FARM FRESH TO FARM FRESH TO YOU 800-796-6009 CA Ref5543286A45S Crd0653 Dt11/20,FARM FRESH TO FARM FRESH TO YOU 800-796-60095543286A45S 0653 Dt11/20,FARM FRESH TO FARM FRES S  20,FARM FRESH TO FARM FRESH TO YOU 800-796-6009 CA A45S,X,X, FARM FRESH TO,X,X
FATHERS OFFICE MELBOURNE FATHERS OFFICE MELBOURNE VI Ref0554400A802 Crd3846 Dt11/24,FATHERS OFFICE MELBOURNE FATHERS OFFICE MELBOURNE VI 0554400A802 3846 Dt11/24,FATHERS OFFICE MELBOURNE FATHERS,FATHERS OFFICE MELBOURNE FATHERS OFFICE MELBOURNE VI A802,X,X, FARM FRESH TO,X,X
FLORATASSE IAT PAYPAL FLORATASSE IAT PAYPAL AI GRANT,FLORATASSE IAT FLORATASSE IAT AI GRANT,FLORATASSE IAT PAYPAL FLORATASSE IAT PAYPAL AI GRANT,X,X,X, FATHERS OFFICE MELBOURNE,X,X
FormSite,pass,FormSite,X,X,X, FLORATASSE IAT,X,X
FORUM COMM CO FORUM COMM CO ACH ITEM 01273369 CONFIANT INC.,X,X,X,X,X,X,FormSite,X
FROM DDA#80003815768 ON 11/30 AT 14.12 Internet Transfer,X,sfer,FROM DDA#80003815768 ON AT 14.49 Internet Transfer,Rm,X, FORUM COMM CO,X,X
FUDDRUCKERS 7423,X,sfer,FROM DDA#80003815768 ON AT 14.12 Internet Transfer,Rm,X,X,sfer,X
GELATISSIMO CQ SYDNEY GELATISSIMO CQ SYDNEY NS Ref0554400A502 Crd3846 Dt11/21,pass,FUDDRUCKERS 7423,X,X,X,X,FUDDRUCKERS,X
GENERAL ASSEMBLY 4155780595 GENERAL ASSEMBLY 4155780595 NY Ref55429509LLW Crd0653 Dt11/03,GELATISSIMO CQGELATISSIMO CQNS 0554400A502 3846 Dt11/21,GELATISSIMO CQ SYDNEY GELATISSIMO CQ SYDNEY NS,GELATISSIMO CQ SYDNEY GELATISSIMO CQ SYDNEY NS A502,X,X,X,GELATISSIMO CQGELATISSIMO CQNS,X
GREEN STAR/CLEANIFY 8664546243 C A            11/23,GENERAL ASSEMBLY 4155780595 GENERAL ASSEMBLY 415578059555429509LLW 0653 Dt11/03,GENERAL ASS SS,GENERAL ASSEMBLY 4155780595 GENERAL ASSEMBLY 4155780595 NY LLW,X,X,X,GENERAL ASS SS,X
GUST EQUITY MANAGEMENT 8778877815 NY,GREEN STAR/CLEANIFY 8664546243 C A 11/23,GREEN S,GREEN STAR/CLEANIFY 8664546243 C A,X,X,X,GREEN S,X
GUSTO -HPT 175624 ACH Debit,X,GUS,X,X,X,X,GUS,X
GUSTO -TLR 170366 ACH Credit,GUSTO -HPT 175624 ACH ,GUS,X,X,X,X,GUS,X
HANDCRAFT KITCHEN AND HANDCRAFT KITCHEN AND NEW YORK NY Ref55421359HQJ Crd3846 Dt11/01,GUSTO -TLR 170366 ACH ,GUS,X,X,X,X,GUS,X
HARD ROCK VEGAS STRIP    LAS VEGAS    NV,HANDCRAFT KITCHEN AND HANDCRAFT KITCHEN ANDNY 55421359HQJ 3846 Dt11/01,X,HANDCRAFT KITCHEN AND HANDCRAFT KITCHEN AND NEW YORK NY HQJ,X,X, HANDCRAFT KITCHEN,X,X
HAZEL SOUTHERN BAR HAZEL SOUTHERN BAR KI SAN FRANCISCO CA Ref0531461A68P Crd9945 Dt11/21,HARD ROCK VEGAS STRIP NV,HARD ROCK VEGAS STRIP    LAS VEGAS    NV,X,X,X,X,X,X
HEALTH NET DES:HEALTHNE20 ID:DBK,HAZEL SOUTHERN BAR HAZEL SOUTHERN BAR KICA 0531461A68P 9945 Dt11/21,HAZEL SOUTHERN BAR HAZEL SOUTHERN BAR KI SAN FRANCIS,HAZEL SOUTHERN BAR HAZEL SOUTHERN BAR KI SAN FRANCISCO CA A68P,X,X, HAZEL SOUTHERN BAR,X,X
"HEXAGRAM ADVERTISING EXCHANGE IN SENDER BNK:=SIL VLY BK SCLA; SENDER ID:=121140399; ORG:=HEXAGRAM ADVERTISING EXCHANGE INC.; ORG ADDRESS:=104 WEST 27TH STREET 11TH FLOOR NEW YORK, NY 10001 ; BNF ID:=3301009020; BNF NAME:=CONFIANT INC.; BNF ADDRESS:=C/O SPARK LABS833 BROADWAY2ND FLOORNEW",X,HEALTH NET DES ID:DBK,X,X,X,X,X,X
HIS*HISCOX INC 888-202-3007 HIS*HISCOX INC 888-202-3007 GA Ref5543286A55V Crd8856 Dt11/21,"HEXAGRAM ADVERTISING EXCHANGE IN SENDER BNK:=SIL VLY BK SCLA; SENDER ID:=121140399; ORG:=HEXAGRAM ADVERTISING EXCHANGE INC.; ORG ADDRESS:=104 WEST 27TH STREET 11TH FLOOR NEW YORK,10001 ; BNF ID:=3301009020; BNF NAME:=CONFIANT INC.; BNF ADDRESS:=C/O SPARK LABS833 BROADWAY2ND FLOORNEW",HEXAGRAM ADVERTISING EXCHANGE IN SENDER BNK:=SIL VLY BK SCLA; S SING EXCHANGE INC.; ORG ADDRESS:=104 WEST S SS:=C/O SPARK  FLOORNEW,X,X,X, EXCHANGE S,X,X
HNDISCOVER ST772,HIS*HISCOX INC 888-202-3007 HIS*HISCOX INC 888-202-3007 GA 5543286A55V 8856 Dt11/21,HIS*HISCOX INC 888-202-3007 HIS*HIS,HIS*HISCOX INC 888-202-3007 HIS*HISCOX INC 888-202-3007 GA A55V,X,X, HIS*HISCOX INC 888-202-3007,X,X
HOTEL UTAH SALOON HOTEL UTAH SALOON SAN FRANCISCO CA Ref25536069W2Y Crd3846 Dt11/10,pass,HNDISCOVER,X,X,X,X,HNDISCOVER,X
HUDSONST1712 1712 JAMAICA NY 0014435 BOOK STORE,HOTEL UTAH SALOON HOTEL UTAH SALOONCA 25536069W2Y 3846 Dt11/10,HOTEL UTAH SALOON HOTEL UTAH SALOON SAN FRANCIS,HOTEL UTAH SALOON HOTEL UTAH SALOON SAN FRANCISCO CA W2Y,X,X, HOTEL UTAH,X,X
IEEE CB CONFERENCE,HUDSONST1712 1712NY 0014435 BOOK STORE,STORE,X,X,X,X,STORE,X
Interest Charge on Promotional,pass,IEEE CB CONFERENCE,X,X,X,X,IEEE CB CONFERENCE,X
INV 10753 COSTELLO AND SONS Miscellaneous Debit,X,Interest Charge on Promotional,X,X,X,X,X,X
"INVISIONAPP INC ACH INVISIONAPP INC ACH Pmt 5027492502 ClearBrain, Inc.",INV 10753 COSTELLO AND SONS Miscellaneous ,STELLO AND SONS Miscellaneous Debit,X,X,X,X,X,X
ITAY HUBARA IAT ITAY HUBARA IAT PAYPAL AI GRANT,X,INVISIONAPP INC ACH INVIS,X,X,X,X,X,X
JAANUU.COM 8444522688 CA JAANUU.COM 8444522688 CA Ref5542950ADJH Crd6153 Dt11/29,ITAY HUBARA IAT ITAY HUBARA IAT AI GRANT,ITAY HUBARA IAT ITAY HUBARA IAT PAYPAL AI GRANT,X,X,X, ITAY HUBARA IAT,X,X
JFK STREET FOOD,JAANUU.COM 8444522688JAANUU.COM 84445226885542950ADJH 6153 Dt11/29,X,JAANUU.COM 8444522688 CA JAANUU.COM 8444522688 CA ADJH,X,X,X,JAANUU.COM,X
JOEYTHECAT.COM SAN FRANCISCO CA OPSNT_BRLNN 5034907423,pass,JFK STREET FOOD,X,X,X,X,JFK STREET FOOD,X
KESSLER WINES & SPIRIT   NEW YORK     NY,JOEYTHECAT.COMCA OPSNT_BRLNN 5034907423,JOEYTHECAT.COM SAN FRANCISCO CA OPS,X,X,X,X,JOEYTHECAT.COMCA OPS,X
Khe-Yo,KESSLER WINES & SPIRIT NY,KESSLER WINES & SPIRIT   NEW YORK     NY,X,X,X,X,X,X
KIDDO 415-3897789 CA,pass,Khe-Yo,X,X,X,X,Khe-Yo,X
KINGS WHARF SUPERMKT KINGS WHARF SUPERMKT SYDNEY NS Ref7523090A300 Crd3846 Dt11/19,pass,X,X,X,X,X,KIDDO  CA,X
KL *WINE MERCHANTS-SSAN FRANCIS 36223273 SAN FRANCISCO,KINGS WHARF SUPERMKT KINGS WHARF SUPERMKTNS 7523090A300 3846 Dt11/19,KINGS WHARF SUPERMKT KINGS WHARF SUPERMKT SYDNEY NS,KINGS WHARF SUPERMKT KINGS WHARF SUPERMKT SYDNEY NS A300,X,X, KINGS WHARF,X,X
KOGI GOGI SAN KOGI GOGI SAN FRANCISCO CA Ref85180899KWG Crd9945 Dt11/02,X,KL *WINE MERCHANTS-SSAN FRANCIS SAN FRANCISCO,X,X,X,X,X,X
"LACOMOTION LLC SENDER BNK:=WELLS FARGO NA; SENDER ID:=121000248; ORG:=LACOMOTION LLC; ORG ADDRESS:=1855 INDUSTRIAL ST STE 106 LOS ANGELES, CA 90021-1239 ; BNF ID:=3302022106; BNF NAME:=BRAAVOS, INC; BNF ADDRESS:=292 TOWNSEND STSAN FRANCISCO, CA 94107; REC FI:=SIL VLY BK",KOGI GOGI SAN KOGI GOGICA 85180899KWG 9945 Dt11/02,KOGI GOGI SAN KOGI GOGI SAN FRANCIS,KOGI GOGI SAN KOGI GOGI SAN FRANCISCO CA KWG,X,X, KOGI,X,X
LARP THAI FOOD & TAPEL CERRITO 33110184 510-326-9851,"LACOMOTION LLC SENDER BNK:=WELLS FARGO NA; SENDER ID:=121000248; ORG:=LACOMOTION LLC; ORG ADDRESS:=1855 INDUSTRIAL ST STE 106 LOS ANGELES,90021-1239 ; BNF ID:=3302022106; BNF NAME:=BRAAVOS, INC; BNF ADDRESS:=292 TOWNSEND STSAN FRANCISCO,94107; REC FI:=SIL VLY BK","LACOMOTION LLC SENDER BNK:=WELLS FARGO NA; S SS:=1855 INDUSTRIAL ST STE 106 LOS ANGELES S, INC; BNF ADDRESS:=292 TOWNSEND STSAN FRANCIS SIL VLY BK",X,X,X,X,X,X
"LATHAM AND WATKINS LLP SENDER BNK:=SIL VLY BK SCLA; SENDER ID:=121140399; SENDER REF:=20173110149800; ORG ID:=3302168751; ORG:=RELAY LABS, INC.; ORG ADDRESS:=2419 HARRISON STREETNUMBER 200SAN FRANCISCO, CA 94110; BNF ID:=3911-7003; BNF NAME:=LATHAM AND WATKINS LLP; BNF ADDRESS:",X,X,X,X,X,X,X,X
LEAVESANDFLOWERS.CO,"LATHAM AND WATKINS LLP SENDER BNK:=SIL VLY BK SCLA; SENDER ID:=121140399; SENDER :=20173110149800; ORG ID:=3302168751; ORG:=RELAY LABS, INC.; ORG ADDRESS:=2419 HARRISON STREETNUMBER 200SAN FRANCISCO,94110; BNF ID:=3911-7003; BNF NAME:=LATHAM AND WATKINS LLP; BNF ADDRESS:","LATHAM AND WATKINS LLP SENDER BNK:=SIL VLY BK SCLA; S S S, INC.; ORG ADDRESS:=2419 HARRISON STREETNUMBER FRANCIS S LLP; BNF ADDRESS:","LATHAM AND WATKINS LLP SENDER BNK:=SIL VLY BK SCLA; SENDER ID:=121140399; SENDER :=20173110149800; ORG ID:=3302168751; ORG:=RELAY LABS, INC.; ORG ADDRESS:=2419 HARRISON STREETNUMBER 200SAN FRANCISCO, CA 94110; BNF ID:=3911-7003; BNF NAME:=LATHAM AND WATKINS LLP; BNF ADDRESS:",X,X, S S,X,X
LEGACY NOLA 2 LLC,pass,LEAVESANDFLOWERS.CO,X,X,X,X,LEAVESANDFLOWERS.CO,X
LETTERMAN DIGITAL,X,LEGACY NOLA 2 LLC,X,X,X,X,X,X
LIGHTBULBSCOM,pass,LETTERMAN DIGITAL,X,X,X,X,LETTERMAN DIGITAL,X
LIGHTHOUSE,pass,LIGHTBULBSCOM,X,X,X,X,LIGHTBULBSCOM,X
LOS ANGELES AIRPORT LOS ANGELES AIRPORT LOS ANGELES CA Ref5531020AALA Crd3846 Dt11/25,pass,LIGHTHOUSE,X,X,X,X,LIGHTHOUSE,X
MAC CENTRE PTY MAC CENTRE PTY LTD SURRY HILLS AU Ref6535310A5PF Crd3846 Dt11/21,LOS ANGELES AIRPORT LOS ANGELES AIRPORT LOS ANGELES5531020AALA 3846 Dt11/25,LOS ANGELES AIRPORT LOS ANGELES AIRPORT LOS ANGELES,LOS ANGELES AIRPORT LOS ANGELES AIRPORT LOS ANGELES CA AALA,X,X, LOS ANGELES AIRPORT LOS,X,X
MAC CENTRE PTY MAC CENTRE PTY LTD SURRY HILLS AU Ref6535310A6PF Crd3846 Dt11/22,MAC CENTRE PTY MAC CENTRE PTY LTDAU 6535310A5PF 3846 Dt11/21,MAC CENTRE PTY MAC CENTRE PTY LTD SURRY HILLS,MAC CENTRE PTY MAC CENTRE PTY LTD SURRY HILLS AU A5PF,X,X, MAC CENTRE PTY,X,X
MACHINEZONEI5063-INVPMT ACH Credit,MAC CENTRE PTY MAC CENTRE PTY LTDAU 6535310A6PF 3846 Dt11/22,MAC CENTRE PTY MAC CENTRE PTY LTD SURRY HILLS,MAC CENTRE PTY MAC CENTRE PTY LTD SURRY HILLS AU A6PF,X,X, MAC CENTRE PTY,X,X
MANTRA 2 BOND MANTRA 2 BOND STREET SYDNEY AU Ref5516000A79Q Crd3846 Dt11/22,pass,INVPMT ACH Credit,X,X,X,X,INVPMT ACH Credit,X
MANTRA 2 BOND MANTRA 2 BOND STREET SYDNEY NS Ref5516000A79E Crd3846 Dt11/22,MANTRA 2 BOND MANTRA 2 BOND STREETAU 5516000A79Q 3846 Dt11/22,MANTRA 2 BOND MANTRA 2 BOND STREET S,MANTRA 2 BOND MANTRA 2 BOND STREET SYDNEY AU A79Q,X,X, MANTRA 2 BOND,X,X
MBI -SETL ACH Debit,MANTRA 2 BOND MANTRA 2 BOND STREETNS 5516000A79E 3846 Dt11/22,MANTRA 2 BOND MANTRA 2 BOND STREET SYDNEY NS,MANTRA 2 BOND MANTRA 2 BOND STREET SYDNEY NS A79E,X,X, MANTRA 2 BOND,X,X
MECCA HAY ST MECCA HAY ST PERTH PERTH WA Ref0554400A202 Crd3846 Dt11/18,MBI -SETL ACH ,MBI -SETL ACH Debit,X,X,X,X,MBI -SETL ACH,X
MELBOURNE SUPPER CLUB MELBOURNE SUPPER CLUB MELBOURNE VI Ref0554400A702 Crd3846 Dt11/23,MECCA HAY ST MECCA HAY ST PERTH PERTH WA 0554400A202 3846 Dt11/18,MECCA HAY ST MECCA HAY S,MECCA HAY ST MECCA HAY ST PERTH PERTH WA A202,X,X, MECCA HAY ST PERTH,X,X
MELBOURNE SUPPER CLUB MELBOURNE SUPPER CLUB MELBOURNE VI Ref0554400A902 Crd3846 Dt11/25,MELBOURNE SUPPER CLUB MELBOURNE SUPPER CLUB MELBOURNE VI 0554400A702 3846 Dt11/23,MELBOURNE SUPPER CLUB MELBOURNE S,MELBOURNE SUPPER CLUB MELBOURNE SUPPER CLUB MELBOURNE VI A702,X,X, MELBOURNE SUPPER CLUB MELBOURNE,X,X
MERCURY TECHNOLO BILL MERCURY TECHNOLO BILL PMT 3302252429 SILICON VALLEY B,MELBOURNE SUPPER CLUB MELBOURNE SUPPER CLUB MELBOURNE VI 0554400A902 3846 Dt11/25,MELBOURNE SUPPER CLUB MELBOURNE S,MELBOURNE SUPPER CLUB MELBOURNE SUPPER CLUB MELBOURNE VI A902,X,X, MELBOURNE SUPPER CLUB MELBOURNE,X,X
MISSION ROCK RESORT SAN FRANCIS 10156320171 4157017625,X,SILICON VALLEY B,X,X,X,X,SILICON VALLEY B,X
MLAB 4157582748 CA MLAB 4157582748 CA Ref55429509JLS Crd8856 Dt11/02,MISSION ROCK RESORT10156320171 4157017625,MISSION ROCK RESORT SAN FRANCIS,X,X,X,X,X,X
MONTHLY SERVICE FEE,MLAB 4157582748MLAB 415758274855429509JLS 8856 Dt11/02,S  02,MLAB 4157582748 CA MLAB 4157582748 CA JLS,X,X,X,S,X
MORDISKO CAKES           SAN MATEO    CA,pass,MONTHLY SERVICE FEE,X,X,X,X,MONTHLY SERVICE FEE,X
MR. TIPPLES SAN MR. TIPPLES SAN FRANCISCO CA Ref2553606A32Y Crd9952 Dt11/17,MORDISKO CAKES CA,MORDISKO CAKES           SAN MATEO    CA,X,X,X,X,MORDISKO CAKES CA,X
NCSBNLICENSEVERIFCTN 312-525-360 NCSBNLICENSEVERIFCTN 312-525-3600 IL Ref55432869W5V Crd6153 Dt11/12,MR. TIPPLES SAN MR. TIPPLESCA 2553606A32Y 9952 Dt11/17,MR. TIPPLES SAN MR. TIPPLES SAN FRANCIS,MR. TIPPLES SAN MR. TIPPLES SAN FRANCISCO CA A32Y,X,X, MR.,X,X
"NETO E-COMMERCE SOLUTIONS PTY LT SENDER BNK:=CITIBANK NYC; SENDER ID:=021000089; ORG:=NETO E-COMMERCE SOLUTIONS PTY LTD; ORG ADDRESS:=LEVEL 3 35 BOUNDARY STREET 4101 SOUTH BRISBANE QLD AUSTRALIA ; ORG FI ID:=NATAAU3303M; BNF ID:=3301415902; BNF NAME:=HOUND TECHNOLOGY, INC.; BNF ADDRESS:=",NCSBNLICENSEVERIFCTN 312-525-360 NCSBNLICENSEVERIFCTN 312-525-3600 IL 55432869W5V 6153 Dt11/12,NCSBNLICENSEVERIFCTN 312-525-360 NCSBNLICENS,NCSBNLICENSEVERIFCTN 312-525-360 NCSBNLICENSEVERIFCTN 312-525-3600 IL W5V,X,X, NCSBNLICENSEVERIFCTN,X,X
NEW ORLEANS CC  CONC 0083,X,NETO E-COMMERCE SOLUTIONS PTY LT SENDER BNK:=CITIBANK NYC; S SOLUTIONS PTY LTD; ORG ADDRESS:=LEVEL 3 35 BOUNDARY STREET 4101 SOUTH BRISBANE QLD AUS SS:=,X,X,X, SOLUTIONS PTY,X,X
NEWEGG PURCHASE WITH MR POINTS,NEW ORLEANS CC CONC 0083,NEW ORLEANS CC  CONC 0083,X,X,X,X,X,X
NOTION PRO 6504851632 NOTION PRO 6504851632 CA Ref5542950A1JH Crd6153 Dt11/17,X,NEWEGG PURCHASE WITH MR POINTS,X,X,X,X,X,X
O'LEARYS -2 01 O'LEARYS -2 01 HONG KONG HK Ref55427679W2X Crd7367 Dt11/11,NOTION PRO 6504851632 NOTION PRO 65048516325542950A1JH 6153 Dt11/17,X,NOTION PRO 6504851632 NOTION PRO 6504851632 CA A1JH,X,X, NOTION PRO,X,X
OFFICEWORKS 0615 PERTH OFFICEWORKS 0615 PERTH AU Ref0528294A12J Crd3846 Dt11/17,O'LEARYS -2 01 O'LEARYS -2 01 HONG KONG HK 55427679W2X 7367 Dt11/11,O'LEARYS -2 01 O'LEARYS,O'LEARYS -2 01 O'LEARYS -2 01 HONG KONG HK W2X,X,X, O'LEARYS -2 01,X,X
OLDE NAWLINS COOKERY,OFFICEWORKS 0615 PERTH OFFICEWORKS 0615 PERTH0528294A12J 3846 Dt11/17,OFFICEWORKS 0615 PERTH OFFICEWORKS,OFFICEWORKS 0615 PERTH OFFICEWORKS 0615 PERTH AU A12J,X,X, OFFICEWORKS 0615 PERTH,X,X
OLEMA PARTNERS 4156639000 OLEMA PARTNERS 4156639000 CA Ref55429509ZJH Crd0653 Dt11/14,pass,OLDE NAWLINS COOKERY,X,X,X,X,OLDE NAWLINS COOKERY,X
ONLINE DOMESTIC WIRE FEE,OLEMA PARTNERS 4156639000 OLEMA PARTNERS 415663900055429509ZJH 0653 Dt11/14,OLEMA PARTNERS S,OLEMA PARTNERS 4156639000 OLEMA PARTNERS 4156639000 CA ZJH,X,X,X,OLEMA PARTNERS S,X
Online Transfer from CHK ...5118 transaction#: 6640946573,X,ONLINE DOMESTIC WIRE FEE,X,X,X,X,X,X
Online Transfer to MMA ...9908 t ransaction#: 6640946573,X,Online Transfer from CHK ...1692 trans,X,Rm,X,X,X,X
"Optimizely, Inc Payment Optimizely, Inc Payment 121880",X,Online Transfer from CHK ...5118 trans,X,Rm,X,X,X,X
ORIGENE TECHNOLOGIESROCKVILLE MD 95090013 301-340-3188,X,Online Transfer from CHK ...5118 trans,X,Rm,X," Optimizely, Inc Payment",X,X
OSAMIL NEW YORK OSAMIL NEW YORK NY Ref85179249HWG Crd3846 Dt10/31,X,Online Transfer to MMA ...9908 t rans,X,Rm,X,X,ORIGENE TECHNOLOGIES,X
OTTER INN 4 MONTEREY CA 00062323 831-375-2299,X,Online Transfer to MMA ...9908 t rans,X,Rm,X,X,OSAMILOSAMILNY HWG,X
PALACE MARKET POINT PALACE MARKET POINT REYES S CA Ref25536069S30 Crd0653 Dt11/09,X,X,X,X,X,X,X,X
PAN PACIFIC MELBOURNE PAN PACIFIC MELBOURNE SOUTH WHARF VI Ref9530131A900 Crd3846 Dt11/24,X,ORIGENE TECHNOLOGIES,X,X,X, PALACE MARKET POINT,X,X
PAN PACIFIC MELBOURNE PAN PACIFIC MELBOURNE SOUTH WHARF VI Ref9530131AA00 Crd3846 Dt11/25,OSAMILOSAMILNY 85179249HWG 3846 Dt10/31,OSAMIL NEW YORK OS,OSAMIL NEW YORK OSAMIL NEW YORK NY HWG,X,X, PAN PACIFIC MELBOURNE,X,X
PANASONIC CATHAY PACIF PANASONIC CATHAY PACIF 04254159641 CA Ref55263529V2D Crd7367 Dt11/11,OTTER INN 4 MONTEREY00062323 831-375-2299,X,X,X,X, PAN PACIFIC MELBOURNE,X,X
PANJIVA.COM       PANJIVA.COM  N DBT Purchase,PALACE MARKET POINT PALACE MARKET POINT REYES S25536069S30 0653 Dt11/09,PALACE MARKET POINT PALACE MARKET POINT REYES S S30  09,PALACE MARKET POINT PALACE MARKET POINT REYES S CA S30,X,X,X,X,X
PASILLA INC.,PAN PACIFIC MELBOURNE PAN PACIFIC MELBOURNE SOUTH WHARF VI 9530131A900 3846 Dt11/24,PAN PACIFIC MELBOURNE PAN PACIFIC MELBOURNE S,PAN PACIFIC MELBOURNE PAN PACIFIC MELBOURNE SOUTH WHARF VI A900,X,X, PANJIVA.COM,X,X
PATRICK HARRINGT BUSBILLPAY PATRICK HARRINGT BUSBILLPAY TRAN#12 Scrapworks Inc.,PAN PACIFIC MELBOURNE PAN PACIFIC MELBOURNE SOUTH WHARF VI 9530131AA00 3846 Dt11/25,PAN PACIFIC MELBOURNE PAN PACIFIC MELBOURNE S,PAN PACIFIC MELBOURNE PAN PACIFIC MELBOURNE SOUTH WHARF VI AA00,X,X,X,PASILLA INC.,X
PAY*BLUE WATER KAYAKIN PAY*BLUE WATER KAYAKIN 415-669-2600 CA Ref05436849JHE Crd0653 Dt10/31,PANASONIC CATHAY PACIF PANASONIC CATHAY PACIF 0425415964155263529V2D 7367 Dt11/11,PANASONIC CATHAY PACIF PANAS,PANASONIC CATHAY PACIF PANASONIC CATHAY PACIF 04254159641 CA V2D,X,X, PATRICK HARRINGT BUSBILLPAY,X,X
PAY*BLUE WATER KAYAKIN PAY*BLUE WATER KAYAKIN 415-669-2600 CA Ref05436849VHE Crd0653 Dt11/10,PANJIVA.COM PANJIVA.COM N DBT Purchase,PANJIVA.COM       PANJIVA.COM  N DBT Purchase,X,X,X, PAY*BLUE WATER KAYAKIN,X,X
PAY*BLUE WATER KAYAKIN PAY*BLUE WATER KAYAKIN 415-669-2600 CA Ref0543684A18P Crd0653 Dt11/17,pass,PASILLA INC.,X,X,X, PAY*BLUE WATER KAYAKIN,X,X
PAY*BLUE WATER KAYAKIN PAY*BLUE WATER KAYAKIN 866-289-5977 CA Ref05436849J8P Crd0653 Dt11/02,X,PATRICK HARRINGT BUSBILLPAY PATRICK HARRINGT BUSBILLPAY TRAN#12 Scrapworks Inc.,X,X,X, PAY*BLUE WATER KAYAKIN,X,X
Payment Thank You-Mobile,PAY*BLUE WATER KAYAKIN PAY*BLUE WATER KAYAKIN 415-669-260005436849JHE 0653 Dt10/31,X,PAY*BLUE WATER KAYAKIN PAY*BLUE WATER KAYAKIN 415-669-2600 CA JHE,X,X, PAY*BLUE WATER KAYAKIN,X,X
PBH Network Inc. PBH Network Inc. Bill.com 015FCLRFWVOHRTT Confiant,PAY*BLUE WATER KAYAKIN PAY*BLUE WATER KAYAKIN 415-669-260005436849VHE 0653 Dt11/10,X,PAY*BLUE WATER KAYAKIN PAY*BLUE WATER KAYAKIN 415-669-2600 CA VHE,X,X,X,Payment Thank You-Mobile,X
PEER5 INC Deposit-Wired Funds,PAY*BLUE WATER KAYAKIN PAY*BLUE WATER KAYAKIN 415-669-26000543684A18P 0653 Dt11/17,X,PAY*BLUE WATER KAYAKIN PAY*BLUE WATER KAYAKIN 415-669-2600 CA A18P,X,X, PBH Network Inc.,X,X
PEER5 INC Deposit-Wired Funds,PAY*BLUE WATER KAYAKIN PAY*BLUE WATER KAYAKIN 866-289-597705436849J8P 0653 Dt11/02,X,PAY*BLUE WATER KAYAKIN PAY*BLUE WATER KAYAKIN 866-289-5977 CA J8P,X,X,X,INC Deposit-Wired Funds,X
PEI WEI C LAS            LAS VEGAS    NV,pass,Payment Thank You-Mobile,X,X,X,X,INC Deposit-Wired Funds,X
PERSISTIQ.COM 4158911140 CA PERSISTIQ.COM 4158911140 CA Ref55429509VJH Crd6244 Dt11/10,X,PBH Network Inc. PBH Network Inc. Bill.com Confiant,X,X,X,X,X,X
PHILA INS CO PHILA INS CO INS IN 83048632 83048632,X,INC Deposit-Wired Funds,X,X,X,X,PERSIS SIS,X
PIN ATM PAYPAL *GGRIJ2 San Jose CA TID11396402 Crd9960 Dt11/24,X,INC Deposit-Wired Funds,X,X,X, PHILA INS CO INS,X,X
PIN ATM PAYPAL *TECH L San Jose CA TID28332262 Crd0257 Dt11/27,PEI WEI C LAS NV,PEI WEI C LAS            LAS VEGAS    NV,X,X,X,X,X,X
PL*PAYLEASE -WEB PMTS ACH Debit,PERSISTIQ.COM 4158911140PERSISTIQ.COM 415891114055429509VJH 6244 Dt11/10,PERSIS SIS,PERSISTIQ.COM 4158911140 CA PERSISTIQ.COM 4158911140 CA VJH,X,X,X,X,X
PL*WILLIAMSREALE-WEB PMTS ACH Debit,X,PHILA INS CO PHILA INS CO INS,X,X,X,X,X,X
PLACEBOPROOF,PIN ATM *GGRIJ2CA TID11396402 9960 Dt11/24,PIN ATM PAYPAL San Jos,PIN ATM PAYPAL *GGRIJ2 San Jose CA TID11396402,X,X,X,PL*WILLIAMSREALE-WEB PMTS ACH,X
"PLANGRID, INC. SENDER BNK:=SIL VLY BK SCLA; SENDER ID:=121140399; ORG:=PLANGRID, INC.; ORG ADDRESS:=2111 MISSION ST 4TH FLOOR SAN FRANCISCO, CA 94110 ; BNF ID:=3301468208; BNF NAME:=SOURCERESS, INC.; BNF ADDRESS:=283 DOLORES STSAN FRANCISCO, CA 94103; OBI:=BY ORDER OF:",PIN ATM *TECH LCA TID28332262 0257 Dt11/27,PIN ATM PAYPAL *TECH L San Jos,PIN ATM PAYPAL *TECH L San Jose CA TID28332262,X,X,X,PLACEBOPROOF,X
POLICE EXECUTIVE RESWASHINGTON 99999997330 2024667820,PL*PAYLEASE -WEB PMTS ACH ,PL*PAYLEASE -WEB PMTS ACH Debit,X,X,X,X,X,X
POLICE EXECUTIVE RESWASHINGTON 99999997333 2024667820,PL*WILLIAMSREALE-WEB PMTS ACH ,PL*WILLIAMSREALE-WEB PMTS ACH Debit,X,X,X,X,POLICE EXECUTIVE RESWAS,X
PORK STORE CAFE PORK STORE CAFE SAN FRANCISCO CA Ref2524780A002 Crd9952 Dt11/16,pass,PLACEBOPROOF,X,X,X,X,POLICE EXECUTIVE RESWAS,X
POST AUSTRALIA SQU POST AUSTRALIA SQU SYDNEY AU Ref5537745A69F Crd3846 Dt11/22,"PLANGRID, INC. SENDER BNK:=SIL VLY BK SCLA; SENDER ID:=121140399; ORG:=PLANGRID, INC.; ORG ADDRESS:=2111 MISSION ST 4TH FLOOR SAN FRANCISCO,94110 ; BNF ID:=3301468208; BNF NAME:=SOURCERESS, INC.; BNF ADDRESS:=283 DOLORES STSAN FRANCISCO,94103; OBI:=BY ORDER OF:","PLANGRID, INC. SENDER BNK:=SIL VLY BK SCLA; S SS:=2111 MISSION ST FLOOR SAN FRANCIS SOURCERESS, INC.; BNF ADDRESS:=283 DOLORES STSAN FRANCIS",X,X,X, PORK STORE,X,X
POST EAST PERTH POST EAST PERTH PO EAST PERTH AU Ref5537745A49Q Crd3846 Dt11/18,X,POLICE EXECUTIVE RESWAS,X,X,X, POST AUSTRALIA,X,X
POST PORT MELBOURN POST PORT MELBOURN PORT MELBOURN AU Ref5537745A89B Crd3846 Dt11/24,X,POLICE EXECUTIVE RESWAS,X,X,X, POST EAST PERTH EAST PERTH,X,X
PROPOSITION CHICKEN SAN PROPOSITION CHICKEN SAN FRANCISCO CA Ref85587469ZS6 Crd3846 Dt11/14,PORK STORE CAFE PORK STORE CAFECA 2524780A002 9952 Dt11/16,PORK STORE CAFE PORK STORE CAFE SAN FRANCIS,PORK STORE CAFE PORK STORE CAFE SAN FRANCISCO CA A002,X,X,X,POSTPOSTPORT MELBOURN AU,X
PSAV AUDIO VISUAL SVCS,POST AUSTRALIA SQU POST AUSTRALIA SQUAU 5537745A69F 3846 Dt11/22,POST AUSTRALIA SQU POST AUSTRALIA SQU S,POST AUSTRALIA SQU POST AUSTRALIA SQU SYDNEY AU A69F,X,X, PROPOSITION,X,X
QANTAS A 0812477217285 QANTAS A 0812477217285 MASCOT AU Ref6535310A1SL Crd3846 Dt11/17,POST EAST PERTH POST EAST PERTH PO EAST PERTH5537745A49Q 3846 Dt11/18,POST EAST PERTH POST EAST PERTH PO EAS,POST EAST PERTH POST EAST PERTH PO EAST PERTH AU A49Q,X,X,X,X,X
RABBIT HOLE BAR RABBIT HOLE BAR SYDNEY NS Ref5516000A69E Crd3846 Dt11/21,POSTPOSTPORT MELBOURN5537745A89B 3846 Dt11/24,POST PORT MELBOURN POS,POST PORT MELBOURN POST PORT MELBOURN PORT MELBOURN AU A89B,X,X,X,X,X
RAMEN SHOP 542929805OAKLAND CA 24224437309 5033519825,PROPOSITION CHICKEN SAN PROPOSITION CHICKENCA 85587469ZS6 3846 Dt11/14,PROPOSITION CHICKEN SAN PROPOSITION CHICKEN SAN FRANCIS S6  14,PROPOSITION CHICKEN SAN PROPOSITION CHICKEN SAN FRANCISCO CA ZS6,X,X, RABBIT HOLE,X,X
RANDAS MARKET SAN RANDAS MARKET SAN FRANCISCO CA Ref75493529HWG Crd9945 Dt10/31,X,PSAV AUDIO VISUAL SVCS,X,X,X,X,RAMEN S,X
