memo,sim1,sim2,sim3,sim4,ext1,ext2,ext3,ext4
""" NUTS ON CLARK "" CHICAGO IL VOR5AA squareup.com/receipts",X,""" NUTS ON CLARK "" CHICAGO IL squareup.com/receipts",X,X,[' NUTS ON CLARK '],X,memo,X
1 800 BAKERY 1 800 BAKERY WINCHESTER MA Ref25247809P01 Crd6153 Dt11/06,1 800 BAKERY 1 800 BAKERY WINCHESTER MA 25247809P01 6153 Dt11/06,1 800 BAKERY 1 800 BAKERY WINCHES,1 800 BAKERY 1 800 BAKERY WINCHESTER MA P01,X,X," """,X,X
1 800 BAKERY 1 800 BAKERY WINCHESTER MA Ref2524780A503 Crd6153 Dt11/20,1 800 BAKERY 1 800 BAKERY WINCHESTER MA 2524780A503 6153 Dt11/20,1 800 BAKERY 1 800 BAKERY WINCHES,1 800 BAKERY 1 800 BAKERY WINCHESTER MA A503,X,X, 1 800 BAKERY,X,X
1 800 BAKERY 1 800 BAKERY WINCHESTER MA Ref2524780A603 Crd6153 Dt11/21,1 800 BAKERY 1 800 BAKERY WINCHESTER MA 2524780A603 6153 Dt11/21,1 800 BAKERY 1 800 BAKERY WINCHES,1 800 BAKERY 1 800 BAKERY WINCHESTER MA A603,X,X, 1 800 BAKERY,X,X
11/01 INVOICE2GO 650-300-5180 CA Debit Card,11/01 INVOICE2GO 650-300-5180,11/01 650-300-5180 CA Debit Card,INVOICE2GO 650-300-5180 CA Debit Card,X,X, 1 800 BAKERY,X,X
11/03 CALZONES PIZZA C SAN FRANC 11/03 CALZONES PIZZA C SAN FRANCISCOCA Debit Card,11/03 CALZONES PIZZA C SAN FRANC 11/03 CALZONES PIZZA C SAN FRANCISCOCA ,11/03 CALZONES PIZZA C SAN FRANC 11/03 CALZONES PIZZA C SAN FRANCISCOCA Debit Card,CALZONES PIZZA C SAN FRANC CALZONES PIZZA C SAN FRANCISCOCA Debit Card,X,X,X,,X
11/03 SQ *TURTLE TOWER SAN FRANC 11/03 SQ *TURTLE TOWER SAN FRANCISCOCA Debit Card,11/03 SQ *TURTLE TOWER SAN FRANC 11/03 SQ *TURTLE TOWER SAN FRANCISCOCA ,11/03 SQ *TURTLE TOWER SAN FRANC 11/03 SQ *TURTLE TOWER SAN FRANCISCOCA Debit Card,SQ *TURTLE TOWER SAN FRANC SQ *TURTLE TOWER SAN FRANCISCOCA Debit Card,X,X, CALZONES PIZZA C SAN,X,X
11/05 82636 - 100 N. L LOS ANGEL 11/05 82636 - 100 N. L LOS ANGELES CA Debit Card,11/05 82636 - 100 N. L LOS ANGEL 11/05 82636 - 100 N. L LOS ANGELES,S S ANGELES CA Debit Card,82636 - 100 N. L LOS ANGEL 82636 - 100 N. L LOS ANGELES CA Debit Card,X,X, SQ *TURTLE TOWER SAN,X,X
11/05 LOS ANGELES INTE LOS ANGEL 11/05 LOS ANGELES INTE LOS ANGELES CA Debit Card,11/05 LOS ANGELES INTE LOS ANGEL 11/05 LOS ANGELES INTE LOS ANGELES,11/05 LOS ANGELES INTE LOS ANGEL 11/05 LOS ANGELES INTE LOS ANGELES CA Debit Card,LOS ANGELES INTE LOS ANGEL LOS ANGELES INTE LOS ANGELES CA Debit Card,X,X, S,S S ANGELES,X
11/05 MERCADO SANTA MONICA CA De 11/05 MERCADO SANTA MONICA CA Debit Card,11/05 MERCADO SANTA MONICADe 11/05 MERCADO SANTA MONICA,11/05 MERCADO SANTA MONICA CA De 11/05 MERCADO SANTA MONICA CA Debit Card,MERCADO SANTA MONICA CA De MERCADO SANTA MONICA CA Debit Card,X,X, LOS LOS ANGELES INTE LOS ANGELES,X,X
11/05 PANINI KABOB GRI SANTA MON 11/05 PANINI KABOB GRI SANTA MONICA CA Debit Card,11/05 PANINI KABOB GRI SANTA MON 11/05 PANINI KABOB GRI SANTA MONICA,11/05 PANINI KABOB GRI SANTA MON 11/05 PANINI KABOB GRI SANTA MONICA CA Debit Card,PANINI KABOB GRI SANTA MON PANINI KABOB GRI SANTA MONICA CA Debit Card,X,X, MERCADO SANTA,X,X
11/05 TUESDAY MORNING SANTA MONI 11/05 TUESDAY MORNING SANTA MONICA CA Debit Card,11/05 TUESDAY MORNING SANTA MONI 11/05 TUESDAY MORNING SANTA MONICA,11/05 TUESDAY MORNING SANTA MONI 11/05 TUESDAY MORNING SANTA MONICA CA Debit Card,TUESDAY MORNING SANTA MONI TUESDAY MORNING SANTA MONICA CA Debit Card,X,X, PANINI KABOB GRI SANTA,X,X
11/06 FATHER'S OFFICE- SANTA MON 11/06 FATHER'S OFFICE- SANTA MONICA CA Debit Card,11/06 FATHER'S OFFICE- SANTA MON 11/06 FATHER'S OFFICE- SANTA MONICA,11/06 FATHER'S OFFICE- SANTA MON 11/06 FATHER'S OFFICE- SANTA MONICA CA Debit Card,FATHER'S OFFICE- SANTA MON FATHER'S OFFICE- SANTA MONICA CA Debit Card,X,X, TUESDAY MORNING SANTA,X,X
11/06 WAHOO'S FISH TAC SANTA MON 11/06 WAHOO'S FISH TAC SANTA MONICA CA Debit Card,11/06 WAHOO'S FISH TAC SANTA MON 11/06 WAHOO'S FISH TAC SANTA MONICA,11/06 WAHOO'S FISH TAC SANTA MON 11/06 WAHOO'S FISH TAC SANTA MONICA CA Debit Card,WAHOO'S FISH TAC SANTA MON WAHOO'S FISH TAC SANTA MONICA CA Debit Card,X,X, FATHER'S OFFICE- SANTA,X,X
11/07 DUC LOI SUPERMAR SAN FRANCISCOCA Debit Card,11/07 DUC LOI SUPERMAR SAN FRANCISCOCA ,11/07 DUC LOI SUPERMAR SAN FRANCISCOCA Debit Card,DUC LOI SUPERMAR SAN FRANCISCOCA Debit Card,X,X, WAHOO'S FISH TAC SANTA,X,X
11/08 KULA REVOLVING S LOS ANGEL 11/08 KULA REVOLVING S LOS ANGELES CA Debit Card,11/08 KULA REVOLVING S LOS ANGEL 11/08 KULA REVOLVING S LOS ANGELES,11/08 KULA REVOLVING S LOS ANGEL 11/08 KULA REVOLVING S LOS ANGELES CA Debit Card,KULA REVOLVING S LOS ANGEL KULA REVOLVING S LOS ANGELES CA Debit Card,X,X,X,X,X
11/08 LAWDEPOT.COM 8775094398 AB Debit Card,11/08 LAWDEPOT.COM 8775094398 AB ,X,LAWDEPOT.COM 8775094398 AB Debit Card,X,X, KULA REVOLVING S LOS,X,X
11/09 THE BRITANNIA SANTA MONICA 11/09 THE BRITANNIA SANTA MONICA CA Debit Card,11/09 THE BRITANNIA SANTA MONICA 11/09 THE BRITANNIA SANTA MONICA,11/09 THE BRITANNIA SANTA MONICA 11/09 THE BRITANNIA SANTA MONICA CA Debit Card,THE BRITANNIA SANTA MONICA THE BRITANNIA SANTA MONICA CA Debit Card,X,X,X,LAWDEPOT.COM  AB,X
11/10 FUNNEL MILL SANTA MONIC CA 11/10 FUNNEL MILL SANTA MONIC CA Debit Card,11/10 FUNNEL MILL SANTA MONIC11/10 FUNNEL MILL SANTA MONIC,11/10 FUNNEL MILL SANTA MONIC CA 11/10 FUNNEL MILL SANTA MONIC CA Debit Card,FUNNEL MILL SANTA MONIC CA FUNNEL MILL SANTA MONIC CA Debit Card,X,X, THE BRITANNIA SANTA MONICA,X,X
11/10 MERCADO SANTA MONICA CA De 11/10 MERCADO SANTA MONICA CA Debit Card,11/10 MERCADO SANTA MONICADe 11/10 MERCADO SANTA MONICA,11/10 MERCADO SANTA MONICA CA De 11/10 MERCADO SANTA MONICA CA Debit Card,MERCADO SANTA MONICA CA De MERCADO SANTA MONICA CA Debit Card,X,X, MILL SANTA,X,X
11/10 TIERRA MIA COFFE OAKLAND CA Debit Card,11/10 TIERRA MIA COFFE OAKLAND,11/10 TIERRA MIA COFFE OAKLAND CA Debit Card,TIERRA MIA COFFE OAKLAND CA Debit Card,X,X, MERCADO SANTA,X,X
11/12 TOWNHOUSE VENICE CA Debit 11/12 TOWNHOUSE VENICE CA Debit Card,11/12 TOWNHOUSE VENICE 11/12 TOWNHOUSE VENICE,11/12 TOWNHOUSE VENICE CA Debit 11/12 TOWNHOUSE VENICE CA Debit Card,TOWNHOUSE VENICE CA Debit TOWNHOUSE VENICE CA Debit Card,X,X,X,X,X
11/16 MOMS BAR & LOUNG LOS ANGEL 11/16 MOMS BAR & LOUNG LOS ANGELES CA Debit Card,11/16 MOMS BAR & LOUNG LOS ANGEL 11/16 MOMS BAR & LOUNG LOS ANGELES,11/16 MOMS BAR & LOUNG LOS ANGEL 11/16 MOMS BAR & LOUNG LOS ANGELES CA Debit Card,MOMS BAR & LOUNG LOS ANGEL MOMS BAR & LOUNG LOS ANGELES CA Debit Card,X,X, TOWNHOUSE VENICE,X,X
11/18 TOCAYA SANTA MON SANTA MON 11/18 TOCAYA SANTA MON SANTA MONICA CA Debit Card,11/18 TOCAYA SANTA MON SANTA MON 11/18 TOCAYA SANTA MON SANTA MONICA,11/18 TOCAYA SANTA MON SANTA MON 11/18 TOCAYA SANTA MON SANTA MONICA CA Debit Card,TOCAYA SANTA MON SANTA MON TOCAYA SANTA MON SANTA MONICA CA Debit Card,X,X, MOMS BAR & LOUNG LOS,X,X
11/18 TWC*TIME WARNER 888-TWCABL 11/18 TWC*TIME WARNER 888-TWCABLE CA Debit Card,11/18 TWC*TIME WARNER 888-TWCABL 11/18 TWC*TIME WARNER 888-TWCABLE,11/18 TWC*TIME WARNER 888-TWCABL 11/18 TWC*TIME WARNER 888-TWCABLE CA Debit Card,TWC*TIME WARNER 888-TWCABL TWC*TIME WARNER 888-TWCABLE CA Debit Card,X,X, SANTA MON TOCAYA SANTA MON SANTA,X,X
11/20 MENDOCINO FARMS SANTA MONI 11/20 MENDOCINO FARMS SANTA MONICA CA Debit Card,11/20 MENDOCINO FARMS SANTA MONI 11/20 MENDOCINO FARMS SANTA MONICA,11/20 MENDOCINO FARMS SANTA MONI 11/20 MENDOCINO FARMS SANTA MONICA CA Debit Card,MENDOCINO FARMS SANTA MONI MENDOCINO FARMS SANTA MONICA CA Debit Card,X,X, TWC*TIME WARNER,X,X
11/21 SWEETFIN POKE S. SANTA MON 11/21 SWEETFIN POKE S. SANTA MONICA CA Debit Card,11/21 SWEETFIN POKE S. SANTA MON 11/21 SWEETFIN POKE S. SANTA MONICA,11/21 SWEETFIN POKE S. SANTA MON 11/21 SWEETFIN POKE S. SANTA MONICA CA Debit Card,SWEETFIN POKE S. SANTA MON SWEETFIN POKE S. SANTA MONICA CA Debit Card,X,X, MENDOCINO FARMS SANTA,X,X
11/22 TST* SPINFISH PO SANTA MON 11/22 TST* SPINFISH PO SANTA MONICA CA Debit Card,11/22 TST* SPINFISH PO SANTA MON 11/22 TST* SPINFISH PO SANTA MONICA,11/22 TST* SPINFISH PO SANTA MON 11/22 TST* SPINFISH PO SANTA MONICA CA Debit Card,TST* SPINFISH PO SANTA MON TST* SPINFISH PO SANTA MONICA CA Debit Card,X,X, SWEETFIN POKE S. SANTA,X,X
11/23 SEOUL HOUSE OF T LOS ANGEL 11/23 SEOUL HOUSE OF T LOS ANGELES CA Debit Card,11/23 SEOUL HOUSE OF T LOS ANGEL 11/23 SEOUL HOUSE OF T LOS ANGELES,11/23 SEOUL HOUSE OF T LOS ANGEL 11/23 SEOUL HOUSE OF T LOS ANGELES CA Debit Card,SEOUL HOUSE OF T LOS ANGEL SEOUL HOUSE OF T LOS ANGELES CA Debit Card,X,X, TST* SPINFISH PO SANTA,X,X
11/24 KULA REVOLVING S LOS ANGEL 11/24 KULA REVOLVING S LOS ANGELES CA Debit Card,11/24 KULA REVOLVING S LOS ANGEL 11/24 KULA REVOLVING S LOS ANGELES,11/24 KULA REVOLVING S LOS ANGEL 11/24 KULA REVOLVING S LOS ANGELES CA Debit Card,KULA REVOLVING S LOS ANGEL KULA REVOLVING S LOS ANGELES CA Debit Card,X,X, SEOUL HOUSE OF T LOS,X,X
11/24 SQ *SIDECAR DOUG SANTA MON 11/24 SQ *SIDECAR DOUG SANTA MONICA CA Debit Card,11/24 SQ *SIDECAR DOUG SANTA MON 11/24 SQ *SIDECAR DOUG SANTA MONICA,11/24 SQ *SIDECAR DOUG SANTA MON 11/24 SQ *SIDECAR DOUG SANTA MONICA CA Debit Card,SQ *SIDECAR DOUG SANTA MON SQ *SIDECAR DOUG SANTA MONICA CA Debit Card,X,X, KULA REVOLVING S LOS,X,X
11/24 WARSZAWA POLISH SANTA MONI 11/24 WARSZAWA POLISH SANTA MONICA CA Debit Card,11/24 WARSZAWA POLISH SANTA MONI 11/24 WARSZAWA POLISH SANTA MONICA,11/24 WARSZAWA POLISH SANTA MONI 11/24 WARSZAWA POLISH SANTA MONICA CA Debit Card,WARSZAWA POLISH SANTA MONI WARSZAWA POLISH SANTA MONICA CA Debit Card,X,X, SQ *SIDECAR DOUG SANTA,X,X
11/25 GOBBLE.COM MEALS HTTPSGOBB 11/25 GOBBLE.COM MEALS HTTPSGOBBLE.CCA Debit Card,11/25 GOBBLE.COM MEALS HTTPSGOBB 11/25 GOBBLE.COM MEALS HTTPSGOBBLE.CCA ,11/25 GOBBLE.COM MEALS HTTPSGOBB 11/25 GOBBLE.COM MEALS HTTPSGOBBLE.CCA Debit Card,GOBBLE.COM MEALS HTTPSGOBB GOBBLE.COM MEALS HTTPSGOBBLE.CCA Debit Card,X,X, WARSZAWA POLISH SANTA,X,X
11/25 OOKOOK KOREAN BB LOS ANGEL 11/25 OOKOOK KOREAN BB LOS ANGELES CA Debit Card,11/25 OOKOOK KOREAN BB LOS ANGEL 11/25 OOKOOK KOREAN BB LOS ANGELES,11/25 OOKOOK KOREAN BB LOS ANGEL 11/25 OOKOOK KOREAN BB LOS ANGELES CA Debit Card,OOKOOK KOREAN BB LOS ANGEL OOKOOK KOREAN BB LOS ANGELES CA Debit Card,X,X, GOBBLE.COM MEALS,X,X
11/25 PAYPAL *MONOTYPE 35314369001 DE Debit Card,11/25 *MONOTYPE 35314369001 DE ,X,PAYPAL *MONOTYPE 35314369001 DE Debit Card,X,X, OOKOOK KOREAN BB LOS,X,X
11/26 TST* BIG DADDY'S VENICE CA 11/26 TST* BIG DADDY'S VENICE CA Debit Card,11/26 TST* BIG DADDY'S VENICE11/26 TST* BIG DADDY'S VENICE,11/26 TST* BIG DADDY'S VENICE CA 11/26 TST* BIG DADDY'S VENICE CA Debit Card,TST* BIG DADDY'S VENICE CA TST* BIG DADDY'S VENICE CA Debit Card,X,X,X,*MONOTYPE  DE,X
11/30 JINYA RAMEN SANTA MONICA CA Debit Card,11/30 JINYA RAMEN SANTA MONICA,11/30 JINYA RAMEN SANTA MONICA CA Debit Card,JINYA RAMEN SANTA MONICA CA Debit Card,X,X, BIG DADDY'S,X,X
1114 6TH STREET SANTA MONICA LLC 1114 6TH STREET SANTA MONICA LLC Cashier Check Purchase,1114 6TH STREET SANTA MONICA LLC 1114 6TH STREET SANTA MONICA LLC ,1114 STREET SANTA MONICA LLC 1114 STREET SANTA MONICA LLC Cashier Check Purchase,X,X,X,X,X,X
266898714 04109315410 MD 266898714 04109315410 MD Ref55446419J2D Crd0653 Dt11/02,266898714 04109315410 MD 266898714 04109315410 MD 55446419J2D 0653 Dt11/02,X,266898714 04109315410 MD 266898714 04109315410 MD J2D,X,X, 1114 STREET SANTA MONICA LLC,X,X
4010 BOSE CORP WEB S8009992673 WH03801139 800-999-2673,X,4010 BOSE CORP WEB,X,X,X, 266898714 04109315410 MD,X,X
41453182 SHOPIFY.COMELK GROVE V OPSNT_BN0QT 8887467439,X,SHOPIFY.COMELK GROVE V OPS,X,X,X,X,X,X
ABACUS LABS INC-EXPENSE ACH Debit,ABACUS LABS INC-EXPENSE ACH ,ABACUS LABS INC-EXPENSE ACH Debit,X,X,X,X,X,X
ABACUS LABS INC-EXPENSE ACH Debit,ABACUS LABS INC-EXPENSE ACH ,ABACUS LABS INC-EXPENSE ACH Debit,X,X,X,X,X,X
ABC LOCKSMITH CO GOSSan Francis JGRCQ2 squareup.com/receipts,X,ABC LOCKSMITH CO GOSSan Francis squareup.com/receipts,X,X,X,X,X,X
AIR INDIA LIMITED AIR INDIA LIMITED 309 II Ref7510517A200 Crd7367 Dt11/17,AIR INDIA LIMITED AIR INDIA LIMITED 309 II 7510517A200 7367 Dt11/17,X,AIR INDIA LIMITED AIR INDIA LIMITED 309 II A200,X,X,X,X,X
Air Solutions LLC 03FREMONT CA 73011007314 HEATING/PLUMBING/AC,Air Solutions LLC 03FREMONT73011007314 HEATING/PLUMBING/AC,Air Solutions,X,X,X, AIR INDIA LIMITED,X,X
ALOFT HOTELS N ORLEANS,X,ALOFT HOTELS N ORLEANS,X,X,X,X,Air Solutions,X
ALTERNATIVE APPAREL SAN FRANCIS 4154005011,ALTERNATIVE APPAREL4154005011,ALTERNATIVE APPAREL SAN FRANCIS,X,X,X,X,X,X
"AMERICAN GIANT, IN AMERICAN GIANT, IN SAN FRANCISCO CA Ref25536069L2Z Crd6153 Dt11/03","AMERICAN GIANT, IN AMERICAN GIANT, INCA 25536069L2Z 6153 Dt11/03","AMERICAN GIANT, IN AMERICAN GIANT, IN SAN FRANCIS","AMERICAN GIANT, IN AMERICAN GIANT, IN SAN FRANCISCO CA L2Z",X,X,X,X,X
"AMERICAN GIANT, IN AMERICAN GIANT, IN SAN FRANCISCO CA Ref2553606A22Z Crd6153 Dt11/17","AMERICAN GIANT, IN AMERICAN GIANT, INCA 2553606A22Z 6153 Dt11/17","AMERICAN GIANT, IN AMERICAN GIANT, IN SAN FRANCIS","AMERICAN GIANT, IN AMERICAN GIANT, IN SAN FRANCISCO CA A22Z",X,X," AMERICAN GIANT,",X,X
"AMIRHOSSEIN DAVOODY SENDER BNK:=SIL VLY BK SCLA; SENDER ID:=121140399; SENDER REF:=20173240249200; ORG ID:=3302154126; ORG:=DEEPLEARNING.AI LLC; ORG ADDRESS:=1611 SHIRLEY AVELOS ALTOS, CA 94024; BNF ID:=0389455202; BNF NAME:=AMIRHOSSEIN DAVOODY; BNF ADDRESS:=812 EAGLE HEIGHT","AMIRHOSSEIN DAVOODY SENDER BNK:=SIL VLY BK SCLA; SENDER ID:=121140399; SENDER :=20173240249200; ORG ID:=3302154126; ORG:=DEEPLEARNING.AI LLC; ORG ADDRESS:=1611 SHIRLEY AVELOS ALTOS,94024; BNF ID:=0389455202; BNF NAME:=AMIRHOSSEIN DAVOODY; BNF ADDRESS:=812 EAGLE HEIGHT",AMIRHOSSEIN DAVOODY SENDER BNK:=SIL VLY BK SCLA; S S SS:=1611 SHIRLEY AVELOS ALTOS SSEIN DAVOODY; BNF ADDRESS:=812 EAGLE HEIGHT,"AMIRHOSSEIN DAVOODY SENDER BNK:=SIL VLY BK SCLA; SENDER ID:=121140399; SENDER :=20173240249200; ORG ID:=3302154126; ORG:=DEEPLEARNING.AI LLC; ORG ADDRESS:=1611 SHIRLEY AVELOS ALTOS, CA 94024; BNF ID:=0389455202; BNF NAME:=AMIRHOSSEIN DAVOODY; BNF ADDRESS:=812 EAGLE HEIGHT",X,X," AMERICAN GIANT,",X,X
"ANDERSEN TAX LLC SENDER BNK:=SIL VLY BK SCLA; SENDER ID:=121140399; SENDER REF:=20173350409100; ORG ID:=3302113753; ORG:=THREADS GROUP, INC.; ORG ADDRESS:=3345 17TH STUNIT 1SAN FRANCISCO, CA 94110; BNF ID:=80000816471; BNF NAME:=ANDERSEN TAX LLC; BNF ADDRESS:=BOX 200988 P","ANDERSEN TAX LLC SENDER BNK:=SIL VLY BK SCLA; SENDER ID:=121140399; SENDER :=20173350409100; ORG ID:=3302113753; ORG:=THREADS GROUP, INC.; ORG ADDRESS:=3345 17TH STUNIT 1SAN FRANCISCO,94110; BNF ID:=80000816471; BNF NAME:=ANDERSEN TAX LLC; BNF ADDRESS:=BOX 200988 P","ANDERSEN TAX LLC SENDER BNK:=SIL VLY BK SCLA; S S S GROUP, INC.; ORG ADDRESS:=3345 STUNIT FRANCIS SEN TAX LLC; BNF ADDRESS","ANDERSEN TAX LLC SENDER BNK:=SIL VLY BK SCLA; SENDER ID:=121140399; SENDER :=20173350409100; ORG ID:=3302113753; ORG:=THREADS GROUP, INC.; ORG ADDRESS:=3345 17TH STUNIT 1SAN FRANCISCO, CA 94110; BNF ID:=80000816471; BNF NAME:=ANDERSEN TAX LLC; BNF ADDRESS:=BOX 200988 P",X,X, S,X,X
"ANDREA LIM SENDER BNK:=SIL VLY BK SCLA; SENDER ID:=121140399; SENDER REF:=20173310206000; ORG ID:=3302154126; ORG:=DEEPLEARNING.AI LLC; ORG ADDRESS:=1611 SHIRLEY AVELOS ALTOS, CA 94024; BNF ID:=6531651476; BNF NAME:=ANDREA LIM; BNF ADDRESS:=10 WAVERLY PLACE HILLSBOR","ANDREA LIM SENDER BNK:=SIL VLY BK SCLA; SENDER ID:=121140399; SENDER :=20173310206000; ORG ID:=3302154126; ORG:=DEEPLEARNING.AI LLC; ORG ADDRESS:=1611 SHIRLEY AVELOS ALTOS,94024; BNF ID:=6531651476; BNF NAME:=ANDREA LIM; BNF ADDRESS:=10 WAVERLY PLACE HILLSBOR",ANDREA LIM SENDER BNK:=SIL VLY BK SCLA; S S SS:=1611 SHIRLEY AVELOS ALTOS SS:=10 WAVERLY PLACE HILLSBOR,"ANDREA LIM SENDER BNK:=SIL VLY BK SCLA; SENDER ID:=121140399; SENDER :=20173310206000; ORG ID:=3302154126; ORG:=DEEPLEARNING.AI LLC; ORG ADDRESS:=1611 SHIRLEY AVELOS ALTOS, CA 94024; BNF ID:=6531651476; BNF NAME:=ANDREA LIM; BNF ADDRESS:=10 WAVERLY PLACE HILLSBOR",X,X, S S TAX,X,X
"ANDREW Y NG SENDER BNK:=WELLS FARGO NA; SENDER ID:=121000248; ORG:=ANDREW Y NG; ORG ADDRESS:=1611 SHIRLEY AVE LOS ALTOS CA 940245326 US ; BNF ID:=3302154126; BNF NAME:=DEEPLEARNING.AI LLC; BNF ADDRESS:=1611 SHIRLEY AVELOS ALTOS, CA 94024; REC FI:=SIL VLY BK SCLA; REC","ANDREW Y NG SENDER BNK:=WELLS FARGO NA; SENDER ID:=121000248; ORG:=ANDREW Y NG; ORG ADDRESS:=1611 SHIRLEY AVE LOS ALTOS940245326 US ; BNF ID:=3302154126; BNF NAME:=DEEPLEARNING.AI LLC; BNF ADDRESS:=1611 SHIRLEY AVELOS ALTOS,94024; REC FI:=SIL VLY BK SCLA; REC",ANDREW Y NG SENDER BNK:=WELLS FARGO NA; S SS:=1611 SHIRLEY AVE LOS ALTOS S SS:=1611 SHIRLEY AVELOS ALTOS SIL VLY BK SCLA; REC,X,X,X, S,X,X
ANTHROPOLOGIE.COM 706-447-6582 P ANTHROPOLOGIE.COM 706-447-6582 PA Ref05436849S2X Crd0653 Dt11/09,ANTHROPOLOGIE.COM 706-447-6582 P ANTHROPOLOGIE.COM 706-447-6582 PA 05436849S2X 0653 Dt11/09,S2X  09,ANTHROPOLOGIE.COM 706-447-6582 P ANTHROPOLOGIE.COM 706-447-6582 PA S2X,X,X, S SS:=1611 SHIRLEY ALTOS,X,X
ARLO NOMAD NEW ARLO NOMAD NEW YORK NY Ref85345519NS6 Crd3846 Dt11/02,ARLO NOMAD NEW ARLO NOMADNY 85345519NS6 3846 Dt11/02,S6  02,ARLO NOMAD NEW ARLO NOMAD NEW YORK NY NS6,X,X, ANTHROPOLOGIE.COM 706-447-6582,X,X
"ARRAM ANDREW SABETI 283 DOLORES INSTRUCTED AMOUNT:=50,000.00 - USD; SENDER BNK:=WELLS FARGO NA; SENDER ID:=121000248; ORG:=ARRAM ANDREW SABETI 283 DOLORES ST; ORG ADDRESS:=SAN FRANCISCO CA 94103 ; ORG FI:=CHARLES SCHWAB AND CO., INC.; ORG FI ADDRESS:=SAN FRANCISCO,US 53202 ; ORG FI ID:=","ARRAM ANDREW SABETI 283 DOLORES INSTRUCTED AMOUNT:=50,000.00 - USD; SENDER BNK:=WELLS FARGO NA; SENDER ID:=121000248; ORG:=ARRAM ANDREW SABETI 283 DOLORES ST; ORG ADDRESS:=SAN FRANCISCO94103 ; ORG FI:=CHARLES SCHWAB AND CO., INC.; ORG FI ADDRESS:=SAN FRANCISCO,US 53202 ; ORG FI ID:=","ARRAM ANDREW SABETI 283 DOLORES INSTRUCTED AMOUNT:=50,000.00 - USD; SENDER BNK:=WELLS FARGO NA; S SABETI 283 DOLORES ST; ORG ADDRESS:=SAN FRANCIS S SCHWAB AND CO., INC.; ORG FI ADDRESS:=SAN FRANCISCO,US",X,X,X, ARLO,X,X
AT&T RECURR BILL PAYDALLAS TX 44043780 800-331-0500,X,AT&T RECURR BILL PAYDALLAS,X,X,X, SABETI 283 DOLORES S ORG ADDRESS:=SAN,X,X
ATM CHECK DEPOSIT 11/14 3681 N B LACKSTONE AVE FRESNO CA,X,ATM CHECK DEPOSIT 11/14 3681 N B LACKSTONE AVE FRESNO CA,ATM CHECK DEPOSIT 3681 N B LACKSTONE AVE FRESNO CA,X,X,X,X,X
ATM WITHDRAWAL 009477  11/143681 N BL,ATM WITHDRAWAL 009477 11/143681 N BL,X,ATM WITHDRAWAL 009477 N BL,X,X,X,X,X
B0912F061A3589 EDI PYMNTS B0912F061A3589 EDI PYMNTS Nuo Yan,X,EDI PYMNTS EDI PYMNTS Nuo Yan,X,X,X,X,X,X
"BACKSTAGE CAPITAL FUND II, LLC SENDER BNK:=FST REP BK SF; SENDER ID:=321081669; ORG:=BACKSTAGE CAPITAL FUND II, LLC; ORG ADDRESS:=1121 N SWEETZER AVE WEST HOLLYWOOD,CA 90069- ; BNF ID:=3302143175; BNF NAME:=DARK, INC.; BNF ADDRESS:=1358 STEVENSON STSAN FRANCISCO, CA 94103; REC FI:=SIL","BACKSTAGE CAPITAL FUND II, LLC SENDER BNK:=FST REP BK SF; SENDER ID:=321081669; ORG:=BACKSTAGE CAPITAL FUND II, LLC; ORG ADDRESS:=1121 N SWEETZER AVE WEST HOLLYWOOD,CA 90069- ; BNF ID:=3302143175; BNF NAME:=DARK, INC.; BNF ADDRESS:=1358 STEVENSON STSAN FRANCISCO,94103; REC FI:=SIL","BACKSTAGE CAPITAL FUND II, LLC SENDER BNK:=FST REP BK SF; S STAGE CAPITAL FUND II, LLC; ORG ADDRESS:=1121 N SWEETZER AVE WES SS:=1358 STEVENSON STSAN FRANCIS SIL",X,X,X, EDI PYMNTS,X,X
Bank of America DES:CASHREWARD I,X,Bank of America DES:CASHREWARD I,X,X,X," CAPITAL FUND II,",X,X
BANK OF THE BANK OF THE WEST HCCLAIMPMT EG30797753 DAVID KAGAN MED CORP,X,BANK OF THE BANK OF THE WES,X,X,X,X,X,X
BEAUDEVIN CHICAGO IL 505164 4004 60666,X,X,X,X,X, BANK OF THE,X,X
BED BATH & BED BATH & BEYOND #651 08004623966 NJ Ref55548079X8A Crd0653 Dt11/12,BED BATH & BED BATH & BEYOND #651 08004623966 NJ 55548079X8A 0653 Dt11/12,X,BED BATH & BED BATH & BEYOND #651 08004623966 NJ X8A,X,X,X,X,X
"BEEHYV SOFTWARE SOLUTIONS PVT. L SENDER ID:=SVBKUS6S; SENDER REF:=20173181225500; ORG ID:=3302074743; ORG:=OPAS AI, INC.; ORG ADDRESS:=250 MIDDLEFIELD ROADMENLO PARK, CA 94025; BNF ID:=0446037552; BNF NAME:=BEEHYV SOFTWARE SOLUTIONS PVT. LTD.; BNF ADDRESS:=PLOT NO 6, RAJA PRAASADAMU, LEV","BEEHYV SOFTWARE SOLUTIONS PVT. L SENDER ID:=SVBKUS6S; SENDER :=20173181225500; ORG ID:=3302074743; ORG:=OPAS AI, INC.; ORG ADDRESS:=250 MIDDLEFIELD ROADMENLO PARK,94025; BNF ID:=0446037552; BNF NAME:=BEEHYV SOFTWARE SOLUTIONS PVT. LTD.; BNF ADDRESS:=PLOT NO 6, RAJA PRAASADAMU, LEV","BEEHYV SOFTWARE SOLUTIONS PVT. L SENDER ID: S S AI, INC.; ORG ADDRESS SOFTWARE SOLUTIONS PVT. LTD.; BNF ADDRESS:=PLOT NO 6, RAJA PRAASADAMU, LEV","BEEHYV SOFTWARE SOLUTIONS PVT. L SENDER ID:=SVBKUS6S; SENDER :=20173181225500; ORG ID:=3302074743; ORG:=OPAS AI, INC.; ORG ADDRESS:=250 MIDDLEFIELD ROADMENLO PARK, CA 94025; BNF ID:=0446037552; BNF NAME:=BEEHYV SOFTWARE SOLUTIONS PVT. LTD.; BNF ADDRESS:=PLOT NO 6, RAJA PRAASADAMU, LEV",X,X, BED BATH &,X,X
BERGERAC/AUDIO 0089 SAN FRANCIS 08810028 415-269-5361,BERGERAC/AUDIO 008908810028 415-269-5361,BERGERAC/AUDIO 0089 SAN FRANCIS,X,X,X, S SOFTWARE SOLUTIONS PVT.,X,X
BLACK CAB VIC BLACK CAB VIC 132227 OAKLEIGH VI Ref8531350A717 Crd3846 Dt11/23,BLACK CAB VIC BLACK CAB VIC 132227 OAKLEIGH VI 8531350A717 3846 Dt11/23,X,BLACK CAB VIC BLACK CAB VIC 132227 OAKLEIGH VI A717,X,X,X,X,X
BLOOMTHAT.COM FLOWERS 8777775411 BLOOMTHAT.COM FLOWERS 8777775411 CA Ref5542950A3JH Crd9952 Dt11/19,BLOOMTHAT.COM FLOWERS 8777775411 BLOOMTHAT.COM FLOWERS 87777754115542950A3JH 9952 Dt11/19,BLOOMTHAT.COM FLOWERS S,BLOOMTHAT.COM FLOWERS 8777775411 BLOOMTHAT.COM FLOWERS 8777775411 CA A3JH,X,X, BLACK CAB VIC,X,X
BOBARRITO SANTA MONICA CA Debit BOBARRITO SANTA MONICA CA Debit Card,BOBARRITO SANTA MONICA BOBARRITO SANTA MONICA,BOBARRITO SANTA MONICA CA Debit BOBARRITO SANTA MONICA CA Debit Card,X,X,X,X,BLOOMTHAT.COM FLOWERS S,X
BP EXP CLARENDON BP EXP CLARENDON 3759 SOUTH MELBOUR VI Ref8531350A815 Crd3846 Dt11/23,BP EXP CLARENDON BP EXP CLARENDON 3759 SOUTH MELBOUR VI 8531350A815 3846 Dt11/23,BP EXP CLARENDON BP EXP CLARENDON 3759 S,BP EXP CLARENDON BP EXP CLARENDON 3759 SOUTH MELBOUR VI A815,X,X, BOBARRITO SANTA MONICA,X,X
BROOKE MCEVER BUSBILLPAY BROOKE MCEVER BUSBILLPAY TRAN#14 Scrapworks Inc.,X,BROOKE MCEVER BUSBILLPAY BROOKE MCEVER BUSBILLPAY TRAN#14 Scrapworks Inc.,X,X,X, BP EXP CLARENDON,X,X
BT*FIN*FIN ACTIVITY SAN FRANSIS FC0GS219 6504139625,X,BT*FIN*FIN ACTIVITY SAN FRANSIS,X,X,X, BROOKE MCEVER BUSBILLPAY,X,X
BUTTER RESTAURANT SURRY BUTTER RESTAURANT SURRY HILLS NS Ref0554400A302 Crd3846 Dt11/19,BUTTER RESTAURANT SURRY BUTTER RESTAURANTNS 0554400A302 3846 Dt11/19,BUTTER RESTAURANT SURRY BUTTER RESTAURANT SURRY HILLS NS,BUTTER RESTAURANT SURRY BUTTER RESTAURANT SURRY HILLS NS A302,X,X,X,X,X
CAESERS BACCHANAL BUFF   LAS VEGAS    NV,CAESERS BACCHANAL BUFF NV,CAESERS BACCHANAL BUFF   LAS VEGAS    NV,X,X,X, BUTTER,X,X
CAFFE CENTRAL - CAFFE CENTRAL - OFARR SAN FRANCISCO CA Ref05314619N00 Crd9937 Dt11/05,CAFFE CENTRAL - CAFFE CENTRAL - OFARRCA 05314619N00 9937 Dt11/05,CAFFE CENTRAL - CAFFE CENTRAL - OFARR SAN FRANCIS,CAFFE CENTRAL - CAFFE CENTRAL - OFARR SAN FRANCISCO CA N00,X,X,X,X,X
CAKO.COM 4158952256 CA CAKO.COM 4158952256 CA Ref55429509XJH Crd6153 Dt11/13,CAKO.COM 4158952256CAKO.COM 415895225655429509XJH 6153 Dt11/13,X,CAKO.COM 4158952256 CA CAKO.COM 4158952256 CA XJH,X,X, CAFFE CENTRAL -,X,X
CAKO.COM 4158952256 CA CAKO.COM 4158952256 CA Ref55429509YJH Crd6153 Dt11/13,CAKO.COM 4158952256CAKO.COM 415895225655429509YJH 6153 Dt11/13,X,CAKO.COM 4158952256 CA CAKO.COM 4158952256 CA YJH,X,X,X,CAKO.COM,X
CAKO.COM 4158952256 CA CAKO.COM 4158952256 CA Ref55429509ZJH Crd6153 Dt11/15,CAKO.COM 4158952256CAKO.COM 415895225655429509ZJH 6153 Dt11/15,X,CAKO.COM 4158952256 CA CAKO.COM 4158952256 CA ZJH,X,X,X,CAKO.COM,X
CAKO.COM 4158952256 CA CAKO.COM 4158952256 CA Ref5542950A5JH Crd6153 Dt11/21,CAKO.COM 4158952256CAKO.COM 41589522565542950A5JH 6153 Dt11/21,X,CAKO.COM 4158952256 CA CAKO.COM 4158952256 CA A5JH,X,X,X,CAKO.COM,X
CALA SAN FRANCISCO CALA SAN FRANCISCO CA Ref8558746AQS7 Crd9952 Dt11/21,CALACALACA 8558746AQS7 9952 Dt11/21,CALA SAN FRANCISCO CALA SAN FRANCIS S7  21,CALA SAN FRANCISCO CALA SAN FRANCISCO CA AQS7,X,X,X,CAKO.COM,X
CALIFORNIA 4152795922 CA CALIFORNIA 4152795922 CA Ref5542950A2JH Crd6153 Dt11/17,CALIFORNIA 4152795922CALIFORNIA 41527959225542950A2JH 6153 Dt11/17,X,CALIFORNIA 4152795922 CA CALIFORNIA 4152795922 CA A2JH,X,X,X,CALACALACA AQS7,X
CAPITAL FACTORY 5125228230 CAPITAL FACTORY 5125228230 TX Ref55429509JJH Crd6153 Dt11/02,CAPITAL FACTORY 5125228230 CAPITAL FACTORY 5125228230 TX 55429509JJH 6153 Dt11/02,X,CAPITAL FACTORY 5125228230 CAPITAL FACTORY 5125228230 TX JJH,X,X,X,CALIFORNIA,X
CARLTON HOTEL (S) CARLTON HOTEL (S) PL SINGAPORE SG Ref05411299X8Q Crd7367 Dt11/12,CARLTON HOTEL (S) CARLTON HOTEL (S) PLSG 05411299X8Q 7367 Dt11/12,CARLTON HOTEL (S) CARLTON HOTEL (S) PL SINGAPORE S,CARLTON HOTEL (S) CARLTON HOTEL (S) PL SINGAPORE SG X8Q,X,X, CAPITAL FACTORY 5125228230,X,X
CDW Direct Vernon HiVernon Hill KTF0457 5252811 94107,X,X,X,X,X, CARLTON HOTEL (S),X,X
CDW Direct Vernon HiVernon Hill KTM2970 5252811 94107,X,X,X,X,X,X,X,X
CENTRO INC CENTRO CENTRO INC CENTRO INC 10377052 Confiant Inc.,X,X,X,X,X,X,X,X
CENTRO INC CENTRO CENTRO INC CENTRO INC 10386134 Confiant Inc.,X,X,X,X,X, CENTRO CENTRO INC CENTRO INC,X,X
CHA CHA MATCHA New York NY VRQ4X6 squareup.com/receipts,CHA CHA MATCHANY VRQ4X6 squareup.com/receipts,CHA CHA MATCHA New York NY squareup.com/receipts,X,X,X, CENTRO CENTRO INC CENTRO INC,X,X
CHECKCARD 1108 BUILT IN 312-4476,CHECK 1108 BUILT IN 312-4476,CHECKCARD 1108 BUILT IN 312-4476,X,X,X, CHA,X,X
CHECKCARD 1127 BRANDBRAVO CREATI,CHECK 1127 BRANDBRAVO CREATI,CHECKCARD 1127 BRANDBRAVO CREATI,X,X,X,X,X,X
CHEF KWONG LLC CHEF KWONG LLC DALY CITY CA Ref5548077A2BL Crd0653 Dt11/17,CHEF KWONG LLC CHEF KWONG LLC DALY CITY5548077A2BL 0653 Dt11/17,X,CHEF KWONG LLC CHEF KWONG LLC DALY CITY CA A2BL,X,X,X,X,X
CHOW CHURCH,pass,CHOW CHURCH,X,X,X, CHEF KWONG LLC,X,X
CIRRUS INSIGHT FOR SIRVINE CA RE_BJ7AE5KC 9492883140,CIRRUS INSIGHT FOR SIRVINERE_BJ7AE5KC 9492883140,CIRRUS INSIGHT FOR S,X,X,X,X,CHOW CHURCH,X
CONEXSYS,pass,CONEXSYS,X,X,X,X,X,X
"Coursera, Inc. Bill.com Coursera, Inc. Bill.com 015FGSPHDQOR44L Deeplearning.ai",X,"Coursera, Inc. Bill.com Coursera, Inc. Bill.com Deeplearning.ai",X,X,X,X,CONEXSYS,X
